{
  "$schema": "../fixture.schema.json",
  "fixture_id": "signature-mismatch",
  "description": "Negative fixture where one object or message carries an invalid signature",
  "seed_peer": "peer-fault",
  "reader_peers": ["peer-reader-a"],
  "fault_peer": "peer-fault",
  "expected_outcomes": [
    "signature-verification-failure",
    "no-invalid-index-write"
  ]
}
