{
    "$schema": "../fixture.schema.json",
    "fixture_id": "session-snapshot-offer-before-hello",
    "description": "Seed injects SNAPSHOT_OFFER before HELLO so the reader rejects the transcript for missing session establishment",
    "seed_peer": "peer-seed",
    "reader_peers": [
        "peer-reader-a"
    ],
    "documents": [
        {
            "doc_id": "doc:session-snapshot-offer-before-hello-test"
        }
    ],
    "expected_outcomes": [
        "snapshot-offer-before-hello-rejected",
        "no-invalid-index-write"
    ],
    "metadata": {
        "session_fault": "snapshot-offer-before-hello"
    },
    "notes": [
        "Simulator injects SNAPSHOT_OFFER ahead of the normal HELLO, before the seed establishes the wire session.",
        "The transcript should fail on the standard prior-HELLO wire-session rule before capability or object processing matters."
    ]
}
