{
    "$schema": "../fixture.schema.json",
    "fixture_id": "session-unadvertised-revision-want-after-manifest",
    "description": "Seed injects WANT for an unadvertised revision after MANIFEST so the reader rejects the transcript as outside accepted sync roots",
    "seed_peer": "peer-seed",
    "reader_peers": [
        "peer-reader-a"
    ],
    "documents": [
        {
            "doc_id": "doc:session-unadvertised-revision-want-after-manifest-test"
        }
    ],
    "expected_outcomes": [
        "unadvertised-revision-want-after-manifest-rejected",
        "no-invalid-index-write"
    ],
    "metadata": {
        "session_fault": "unadvertised-revision-want-after-manifest"
    },
    "notes": [
        "Simulator injects WANT immediately after MANIFEST, but targets a revision that the accepted sync roots do not advertise as reachable.",
        "The transcript should fail on the standard accepted-sync-roots reachability rule before any object verification or store writes happen."
    ]
}
